codigo_curso,nombre_curso,catedratico,auxiliar
250,MECANICA DE FLUIDOS,LUIS EDUARDO PORTILLO ESPAÑA,JOSÉ DANIEL PALACIOS GUZMÁN
311,ANALISIS ESTRUCTURAL,OSWALDO JOSE OROZCO AREAS,xxx
252,HIDRAULICA,CARLOS SALVADOR GORDILLO GARCIA,JOSÉ ROBERTO SIERRA GARRIDO
322,DISE\O ESTRUCTURAL 1,OSWALDO JOSE OROZCO AREAS,xxx
324,DISE\O ESTRUCTURAL 2,LUIS ESTUARDO SARAVIA RAMIREZ,xxx
458,MECANICA DE SUELOS 1,OMAR ENRIQUE MEDRANO MENDEZ,xxx
1035,DIPLOMADO EN MATEMATICAS DE INGENIERIA,JORGE MARCELO IXQUIAC CABRERA,xxx
300,RESISTENCIA DE MATERIALES 1,DARIO FRANCISCO LUCAS MAZARIEGOS,JUAN MANUEL CHAVAJAY SOSA
302,RESISTENCIA DE MATERIALES 2,OMAR ENRIQUE MEDRANO MENDEZ,xxx
453,MATERIALES DE CONSTRUCCION 1,DILMA YANET MEJICANOS JOL,NERY NEFTALY QUIROA ARRIAZA
80,TOPOGRAFIA 1,MARIO ESTUARDO ARRIOLA AVILA,xxx
82,TOPOGRAFIA 2,MARIO ESTUARDO ARRIOLA AVILA,xxx
84,TOPOGRAFIA 3,NICOLAS DE JESUS GUZMAN SAENZ,xxx
550,VIAS TERRESTRES 1,CARLOS ENRIQUE PINTO ALONZO,xxx
455,MATERIALES DE CONSTRUCCION 2,BRANDON EDEVAÍR ESTRADA TARACENA,NERY NEFTALY QUIROA ARRIAZA
236,SISTEMAS DE CONTROL 1,MIGUEL VENTURA PEREZ,xxx
246,ELECTRONICA 3,HILDA FABIOLA ESPAÑA GIRÓN,xxx
522,PROCESOS DE MANUFACTURA 2,VICTOR MANUEL RUIZ HERNANDEZ,xxx
200,INGENIERIA ELECTRICA 1,ANA MARÍA NAVARRO  OROZCO,xxx
202,INGENIERIA ELECTRICA 2,EDGAR YANUARIO LAJ HUN,xxx
204,CIRCUITOS ELECTRICOS 1,JULIO ROLANDO BARRIOS ARCHILA,xxx
206,CIRCUITOS ELECTRICOS 2,JORGE MARIO SITAVI COS,xxx
208,INSTALACIONES ELECTRICAS,CARLOS ALBERTO NAVARRO FUENTES,xxx
210,TEORIA ELECTROMAGNETICA 1,MATILDE LUCRECIA MARTINEZ AGUIRRE,xxx
230,INSTRUMENTACION ELECTRICA,OTTO FERNANDO ANDRINO GONZALEZ,xxx
232,ELECTRONICA  1,CARLOS EDUARDO GUZMAN SALAZAR,xxx
235,ROBOTICA,WENDY NORA MIRANDA LOPEZ,xxx
240,ELECTRONICA 2,HUGO LEONEL TIUL VALENZUELA,xxx
242,COMUNICACIONES 1,WENDY NORA MIRANDA LOPEZ,xxx
243,COMUNICACIONES 4,GUILLERMO ANTONIO PUENTE ROMERO,xxx
244,COMUNICACIONES 2,WENDY NORA MIRANDA LOPEZ,xxx
245,COMUNICACIONES 3,CHRISTIAN ANTONIO ORELLANA LÓPEZ,xxx
248,ELECTRONICA 5,MIGUEL VENTURA PEREZ,xxx
249,ELECTRONICA 6,LIGIA DEYANIRA AGUILAR ESTRADA,xxx
258,MAQUINAS HIDRAULICAS,HERBERT SAMUEL FIGUEROA AVENDAÑO,xxx
354,QUIMICA 3,MERCEDES ESTHER ROQUEL CHAVEZ,JOSE ALBERTO MEDINA CALGUA
358,QUIMICA ORGANICA 1,ERWIN MANUEL ORTIZ CASTILLO,xxx
360,QUIMICA ORGANICA 2,MERCEDES ESTHER ROQUEL CHAVEZ,PABLO ANDRÉS VARGAS DONADO
362,ANALISIS CUALITATIVO,MERCEDES ESTHER ROQUEL CHAVEZ,"1) JOSE JAVIER DE PAZ OLAVARRUETH 
                                                            2) MARJORIE JULIETA MARTÍNEZ BARRIOS"
364,ANALISIS CUANTITATIVO,CINTHYA PATRICIA ORTIZ QUIROA,"1) GINGER MARIE GAITAN FONG 
                                                            2) MARJORIE JULIETA MARTÍNEZ BARRIOS"
366,ANALISIS INSTRUMENTAL,INGRID LORENA BENITEZ PACHECO,KIMBERLY NATALIE MORALES CONTRERAS
440,MICROBIOLOGIA,PABLO ENRIQUE MORALES PANIAGUA,xxx
454,METALURGIA Y METALOGRAFIA,HUGO LEONEL RAMIREZ ORTIZ,xxx
462,ELECTRICIDAD Y ELECTRONICA BASICA,MARIO ALBERTO REYES CALDERÓN,xxx
502,REFRIGERACION Y AIRE ACONDICIONADO,LUIS ALFREDO ASTURIAS ZUNIGA,xxx
504,MOTORES DE COMBUSTION INTERNA,BYRON GIOVANNI PALACIOS COLINDRES,xxx
510,INSTALACIONES MECANICAS,PABLO RODOLFO ZUÑIGA RAMIREZ,xxx
520,PROCESOS DE MANUFACTURA 1,LUIS EDUARDO CORONADO NOJ,xxx
532,VIBRACIONES,FREDY MAURICIO MONROY PERALTA,xxx
969,TELECOMUNICACIONES Y REDES LOCALES,JOSÉ RODRIGO DE LEÓN VELÁSQUEZ,xxx
799,SEMINARIO DE INVESTIGACION,DIANA ORALIA SALGUERO ESPANA,xxx
1,ETICA PROFESIONAL,ROGELIO ALFREDO SALAZAR DE LEON,xxx
5,TECNICAS DE ESTUDIO E INVESTIGACION,EDUARDO MARTIN RIVERA PÉREZ,xxx
8,IDIOMA TECNICO 2,SORAYA DEL ROSARIO MARTINEZ SUM,FATIMA SOFIA JUAREZ SORIA
9,IDIOMA TECNICO 3,CARLOS LEONEL MUÑOZ LEMUS,xxx
17,AREA SOCIAL HUMANISTICA 1,ANA VELA CASTRO MELLADO,MARIANA ABUGARADE SCHIPPERS
18,FILOSOFIA DE LA CIENCIA,ROGELIO ALFREDO SALAZAR DE LEON,FRANCISCO ERNESTO CARVAJAL CASTILLO
19,AREA SOCIAL HUMANISTICA 2,HILDA MYRIAM MÉNDEZ CASTILLO DE AVILA,FRANCISCO ERNESTO CARVAJAL CASTILLO
27,BIOLOGIA,PABLO ENRIQUE MORALES PANIAGUA,xxx
30,GEOGRAFIA,ALAN GIOVANI COSILLO PINTO,xxx
69,AREA TECNICA COMPLEMENTARIA 1,JUAN ALBERTO ORTIZ ESTURBAN,CATHERIN ELOISA FUENTES GÓMEZ
74,DIBUJO CONSTRUCTIVO PARA INGENIERIA,ANDREA SUSANA LÓPEZ RAMÍREZ,YOLANDA ELIZABETH SILVESTRE SANDOVAL
90,PROGRAMACION DE COMPUTADORAS 1,HERMAN IGOR VELIZ LINARES,xxx
101,AREA MATEMATICA BASICA 1,RAMON BENJAMIN PIEDRASANTA BATZ,ERICK DANIEL CHAJON GALVEZ
103,AREA MATEMATICA BASICA 2,GLENDA PATRICIA GARCIA SORIA,WALTER SAUL OSORIO LEIVA
107,AREA MATEMATICA INTERMEDIA 1,ARTURO RODRIGO SAMAYOA DARDON,JENNIFER ELIZABETH MUÑOZ CALDERÓN
112,AREA MATEMATICA INTERMEDIA 2,CARLOS ALBERTO GARRIDO LOPEZ,WALTER SAUL OSORIO LEIVA
114,AREA MATEMATICA INTERMEDIA 3,ERICKA JOHANA CANO DIAZ,ALEXANDER ABIMAEL SANAN FRANCO
116,MATEMATICA APLICADA 3,JOSE ALFONSO VELASQUEZ DIAZ,EDGARD ABRAHAM GARCÍA CUTZ
118,MATEMATICA APLICADA 1,JOSE ALFONSO VELASQUEZ DIAZ,EDGARD ABRAHAM GARCÍA CUTZ
123,MATEMATICA APLICADA 5,LUIS CARLOS BOLANOS MENDEZ,ANGEL REGINALDO CORDERO MELARA
147,FISICA BASICA,OSWALDO ROMEO ESCOBAR ALVAREZ,HECTOR MAURICIO CACERES LARA
152,FISICA 2,CARLOS ANTONIO CAJAS VIDAURRE,JISHAR LEVÍ ALVARADO VELASQUEZ
154,FISICA 3,WALTER GIOVANNI ALVAREZ MARROQUIN,MYNOR DAVID RAMÍREZ ORELLANA
170,MECANICA ANALITICA 1,OSWALDO ROMEO ESCOBAR ALVAREZ,DANIEL ANTULIO CAMEY MARTÍNEZ
281,SISTEMAS OPERATIVOS 1,JESUS ALBERTO GUZMAN POLANCO,xxx
283,ANALISIS Y DISE\O DE SISTEMAS 1,WILLIAM SAMUEL GUEVARA ORELLANA,xxx
285,SISTEMAS OPERATIVOS 2,EDGAR RENE ORNELIS HOIL,xxx
314,CONCRETO ARMADO 1,YEFRY VALENTIN ROSALES JUAREZ,JOSSELINE JESSENIA GARCÍA PAREDES
318,CIMENTACIONES 1,OMAR ENRIQUE MEDRANO MENDEZ,xxx
352,QUIMICA 2,FRANCISCO ABEN ROSALES CEREZO,xxx
380,FISICO QUIMICA 1,ANA RUFINA HERRERA SOTO,xxx
382,FISICO QUIMICA 2,WILLIAM EDUARDO FAGIANI CRUZ,LESLY JOHANA RUÍZ MARROQUÍN
386,LABORATORIO DE FISICO QUIMICA 1,ANA RUFINA HERRERA SOTO,LESLY JOHANA RUÍZ MARROQUÍN
388,LABORATORIO DE FISICO QUIMICA 2,JULIO DAVID VARGAS GARCIA,LESLY JOHANA RUÍZ MARROQUÍN
392,TERMODINAMICA 2,ROBERTO GUZMAN ORTIZ,xxx
394,TERMODINAMICA 3,ANA RUFINA HERRERA SOTO,LESLY JOHANA RUÍZ MARROQUÍN
410,BALANCE DE MASA Y ENERGIA,ORLANDO POSADAS VALDEZ,xxx
412,FLUJO DE FLUIDOS,PABLO ENRIQUE MORALES PANIAGUA,xxx
428,LABORATORIO DE INGENIERIA QUIMICA 1,JORGE EMILIO GODINEZ LEMUS,ERVIN HUMBERTO LÓPEZ DE LEÓN
430,LABORATORIO DE INGENIERIA QUIMICA 2,MANUEL GILBERTO GALVAN ESTRADA,ERVIN HUMBERTO LÓPEZ DE LEÓN
450,GEOLOGIA,CARLA DEYANIRA GORDILLO DE MARCHENA,ANGELA GABRIEL ROSAS RUBIO
452,CIENCIA DE LOS MATERIALES,AURELIA ANABELA CORDOVA ESTRADA,xxx
601,INVESTIGACION DE OPERACIONES I,AURELIA ANABELA CORDOVA ESTRADA,CARLOS ANTONIO CASTELLANOS IRUNGARAY
608,INTROD DE PROYECTOS GERENCIALES,HUGO LEONEL ALVARADO DE LEON,xxx
610,INFORMATICA,YESSENIA JANIRA MARROQUÍN MARTÍNEZ,xxx
630,INGENIERIA DE LA PRODUCCION,ALBERTO EULALIO HERNANDEZ GARCIA,xxx
632,INGENIERIA DE PLANTAS,JOSE ROLANDO CHAVEZ SALAZAR,xxx
636,DISE\O PARA LA PRODUCCION,ALBERTO EULALIO HERNANDEZ GARCIA,xxx
637,DISEÑO INDUSTRIAL,JOSE ROLANDO CHAVEZ SALAZAR,xxx
638,CONTROLES INDUSTRIALES,JULIO  OSWALDO ROJAS  ARGUETA,xxx
640,CONTROL DE LA PRODUCCION,MARIA MARTHA WOLFORD E. DE HERNANDEZ,xxx
642,SEGURIDAD E HIGIENE INDUSTRIAL,LAURA ROSMERY BRIONES ZELADA,xxx
650,CONTABILIDAD 1,EDWIN JOSUE IXPATA REYES,xxx
652,CONTABILIDAD 2,ELMER DIONICIO SUC CHOCOOJ,xxx
654,CONTABILIDAD 3,YOCASTA  IVANOBLA ORTIZ DEL CID,xxx
656,ADMINISTRACION DE EMPRESAS 1,JOSE ANTONIO CAMBARA GODOY,xxx
658,ADMINISTRACION DE PERSONAL,RENATO ISAAC RIVERA PEREZ,xxx
660,MERCADOTECNIA 1,OSCAR APARICIO SEGURA MONZON,xxx
662,LEGISLACION 1,OSCAR APARICIO SEGURA MONZON,xxx
663,LEGISLACION AMBIENTAL 1,MARIA ALEJANDRA MA VILLATORO,xxx
665,MICROECONOMIA,NORA LEONOR GARCIA TOBAR,xxx
667,PROGRAMACION COMERCIAL 1,GUIPPSY JEANNIRA MENENDEZ PEREZ,xxx
687,GEOLOGIA ESTRUCTURAL,JULIO ROBERTO LUNA AROCHE,xxx
700,INGENIERIA ECONOMICA 1,ALBA MARITZA GUERRERO SPINOLA,ELFEGO ALEJANDRO MORALES ZAVALA
706,PREPARACION Y EVALUACION DE PROYECTOS 1,ALBA MARITZA GUERRERO SPINOLA,ELFEGO ALEJANDRO MORALES ZAVALA
708,PREPARACION Y EVALUACION DE PROYECTOS 2,SURIEL CRISTINA ABALLI HERWING,xxx
720,MODELACION Y SIMULACION 2,MIGUEL ANGEL CANCINOS RENDON,xxx
722,TEORIA DE SISTEMAS 1,JORGE LUIS ALVAREZ MEJIA,KEILA AVRIL VILCHEZ SUÁREZ
724,TEORIA DE SISTEMAS 2,JORGE LUIS ALVAREZ MEJIA,VANIA GARED YUSEIMY ARGUETA RODRÍGUEZ
729,MODELACION Y SIMULACION 1,CESAR AUGUSTO FERNANDEZ CACERES,xxx
734,ESTADISTICA 2,MAYRA VIRGINIA CARVAJAL CASTILLO,ASTRID  DANIELA GÁLVEZ-SOBRAL  ARAUJO
735,AUDITORIA DE PROYECTOS DE SOFTWARE,CARLOS GUSTAVO ALONZO,xxx
736,ANALISIS PROBABILISTICO,LADY MARIEBELIA ELIAS ESTRADA,CHRISTOFER WILLIAM BORRAYO LÓPEZ
770,INTRODUCCION A LA PROGRAMACION Y COMPUTACION 1,MANUEL HAROLDO CASTILLO REYNA,xxx
771,INTRODUCCION A LA PROGRAMACION Y COMPUTACION 2,MARLON ANTONIO PEREZ TURK,xxx
772,ESTRUCTURAS DE DATOS,EDGAR RENE ORNELIS HOIL,xxx
773,MANEJO E IMPLEMENTACION DE ARCHIVOS,JUAN ALVARO DIAZ ARDAVIN,xxx
775,SISTEMAS DE BASES DE DATOS 2,OTTO AMILCAR RODRIGUEZ ACOSTA,xxx
778,ARQUITECTURA DE COMPUTADORES Y ENSAMBLADORES 1,OTTO RENE ESCOBAR LEIVA,xxx
779,ARQUITECTURA DE COMPUTADORES Y ENSAMBLADORES 2,GABRIEL ALEJANDRO DIAZ LOPEZ,xxx
780,SOFTWARE AVANZADO,EVEREST DARWIN MEDINILLA RODRIGUEZ,xxx
781,ORGANIZACION DE LENGUAJES Y COMPILADORES 2,BAYRON WOSVELY LOPEZ LOPEZ,xxx
785,ANALISIS Y DISE\O DE SISTEMAS 2,CLAUDIA LICETH ROJAS MORALES,xxx
786,SISTEMAS ORGANIZACIONALES Y GERENCIALES 1,FERNANDO JOSÉ PAZ GONZÁLEZ,xxx
788,SISTEMAS APLICADOS 1,CARLOS GUSTAVO ALONZO,xxx
790,EMPRENDEDORES DE NEGOCIOS INFORMATICOS,CARLOS GUSTAVO ALONZO,xxx
795,LOGICA DE SISTEMAS,VIRGINIA VICTORIA TALA AYERDI,JOSSELINE SUSETH GODINEZ GARCIA
797,SEMINARIO DE SISTEMAS I,MANUEL FERNANDO LOPEZ FERNANDEZ,xxx
798,SEMINARIO DE SISTEMAS 2,LUIS ALBERTO VETTORAZZI ESPANA,xxx
960,MATEMATICA PARA COMPUTACION 1,CARLOS AUGUSTO MORALES SANTACRUZ,EDUARDO RENÉ AGUSTIN MENDOZA
962,MATEMATICA PARA COMPUTACION 2,JOSE ALFREDO GONZALEZ DIAZ,ROBERTO CARLOS GÓMEZ DONIS
964,ORGANIZACION COMPUTACIONAL,OTTO RENE ESCOBAR LEIVA,xxx
968,INTELIGENCIA ARTIFICIAL 2,LUIS FERNANDO ESPINO BARRIOS,xxx
970,REDES DE COMPUTADORAS 1,LUIS FERNANDO ESPINO BARRIOS,xxx
972,INTELIGENCIA ARTIFICIAL 1,LUIS FERNANDO ESPINO BARRIOS,xxx
1023,DIPLOMADO EN ACONDICIONAMIENTO DEL AGUA EN LA INDUSTRIA,JORGE LUIS PALACIOS PINTO,xxx
1059,DIPLOMADO BUENAS PRACTICAS DE MAN EN LA IND FARMA Y ALIMENTICIA,ANA PAOLA MÉNDEZ DE LEÓN,xxx
1088,DIPLOMADO REDACCION Y ORTOGRAFIA PARA LA INGENIERIA,GREYSI ILDOARA CALDERON CHAY,xxx
2004,PRACTICAS FINALES INGENIERIA ELECTRICA,FRANCISCO JAVIER GONZALEZ LOPEZ,xxx
2005,PRACTICAS FINALES INGENIERIA INDUSTRIAL,SIGRID ALITZA CALDERON DE LEON,xxx
2006,PRACTICAS FINALES INGENIERIA MECANICA ELECTRICA,FRANCISCO JAVIER GONZALEZ LOPEZ,xxx
3116,MATEMATICA APLICADA 3 (DIPLOMADO),JOSE ALFONSO VELASQUEZ DIAZ,xxx
3118,MATEMATICA APLICADA 1 (DIPLOMADO),JOSE ALFONSO VELASQUEZ DIAZ,xxx
3123,MATEMATICA APLICADA 5 (DIPLOMADO),LUIS CARLOS BOLANOS MENDEZ,xxx
3656,ADMINISTRACION DE EMPRESAS 1 (DIPLOMADO),JOSE ANTONIO CAMBARA GODOY,xxx
3658,ADMINISTRACION DE PERSONAL (DIPLOMADO),RENATO ISAAC RIVERA PEREZ,xxx
3662,LEGISLACION 1 (DIPLOMADO),OSCAR APARICIO SEGURA MONZON,xxx
14,ECONOMIA,ILEANA GUISELA RALDA R. DE ILLESCAS,PABLO FERNANDO CABRERA PINEDA
22,PSICOLOGIA INDUSTRIAL,OTTO LEONEL SUÁREZ MOTA,xxx
28,ECOLOGIA,MARILYN CARIBEL ROJAS MALDONADO,xxx
150,FISICA 1,ERIC JOSUE JACOBS MAZARIEGOS,HECTOR MAURICIO CACERES LARA
603,INVESTIGACION DE OPERACIONES II,NORA LEONOR GARCIA TOBAR,CARLOS DAVID FONCEA SIAN
664,LEGISLACION 2,JULIO CÉSAR VILLATORO SANABRIA,xxx
732,ESTADISTICA 1,EDWIN ADALBERTO BRACAMONTE OROZCO,ALEJANDRA MARISOL RODRÍGUEZ MOYA
796,LENGUAJES FORMALES Y DE PROGRAMACION,OTTO AMILCAR RODRIGUEZ ACOSTA,xxx
2025,PRACTICAS INICIALES,MAYRA REBECA GARCIA SORIA DE SIERRA,xxx
2036,PRACTICAS INTERMEDIAS,OSCAR ARGUETA HERNANDEZ,xxx
3022,PSICOLOGIA INDUSTRIAL (DIPLOMADO),OTTO LEONEL SUÁREZ MOTA,xxx
3664,LEGISLACION 2 (DIPLOMADO),JULIO CÉSAR VILLATORO SANABRIA,xxx
9000,P.A.P. DE MATEMATICA PARA INGENIERIA,LUIS FELIPE PEREZ URIAS,xxx
156,FISICA 4,JOSE ALEJANDRO ARRIAGA CARDONA,xxx
234,ELECTRONICA 4,CARLOS EDUARDO GUZMAN SALAZAR,xxx
39,DEPORTES 1,MARIO ENRIQUE RIVERA GONZALEZ,GABRIEL ALEJANDRO VILLATORO PÉREZ
348,QUIMICA GENERAL 1,BERTHA ROXANDA MOLINA LEON DE QUINTO,xxx
774,SISTEMAS DE BASES DE DATOS 1,LUIS FERNANDO ESPINO BARRIOS,xxx
777,ORGANIZACION DE LENGUAJES Y COMPILADORES 1,MANUEL HAROLDO CASTILLO REYNA,xxx
2013,PRACTICAS FINALES INGENIERIA ELECTRONICA,KENNETH ISSUR ESTRADA RUIZ,xxx
349,QUIMICA PARA INGENIERIA CIVIL,ADELA MARIA MARROQUIN GONZALEZ,ALBA MAGNOLIA GARCÍA ASPUACA
634,INGENIERIA DE METODOS,MARIA MARTHA WOLFORD E. DE HERNANDEZ,xxx
2009,PRACTICAS FINALES INGENIERIA CIENCIAS Y SISTEMAS,FLORIZA FELIPA AVILA PESQUERA DE MEDINILLA,xxx
2003,PRACTICAS FINALES INGENIERIA MECANICA,DIEGO ISRAEL NAVARRO GODINEZ,xxx
6,IDIOMA TECNICO 1,ERICKA NATHALIE LOPEZ TORRES,LUIS PEDRO ZALDAÑA BRAVO
2007,PRACTICAS FINALES INGENIERIA MECANICA INDUSTRIAL,JAIME HUMBERTO BATTEN ESQUIVEL,xxx
2002,PRACTICAS FINALES INGENIERIA QUIMICA,SERGIO ALEJANDRO RECINOS,xxx
2001,PRACTICAS FINALES INGENIERIA CIVIL,CHRISTA DEL ROSARIO CLASSON REHWOLDT DE PINTO,xxx
254,HIDROLOGIA,CLAUDIO CESAR CASTAÑON CONTRERAS,xxx
288,INTRODUCCION AL ESTUDIO DE IMPACTO AMBIENTAL,PABLO CESAR ANÍBAL SARAVIA SOLARES,xxx
390,TERMODINAMICA 1,ESDRAS FELICIANO MIRANDA OROZCO,xxx
7983,SEMINARIO DE INVESTIGACION E.P.S. MECANICA,EDWIN ESTUARDO SARCEÑO ZEPEDA,xxx
212,CONVERSION DE ENERGIA ELECTROMECANICA 1,JOSÉ LUIS MENDÓZA ALVARADO,xxx
214,MAQUINAS ELECTRICAS,JUAN CARLOS MORATAYA RAMOS,xxx
219,TRANSMISION Y DISTRIBUCION,EDGAR  ESTUARDO CHAJ  RAMIREZ,xxx
220,ANALISIS DE SISTEMAS DE POTENCIA 1,EDGAR  ESTUARDO CHAJ  RAMIREZ,xxx
224,ALTA TENSION,EDGAR  ESTUARDO CHAJ  RAMIREZ,xxx
238,AUTOMATIZACION INDUSTRIAL,SAUL CABEZAS DURAN,xxx
11,IDIOMA TECNICO 4,CARLOS LEONEL MUÑOZ LEMUS,LUIS PEDRO ZALDAÑA BRAVO
60,TALLER DE SIST DE INF GEOGRAFICA,WALTER ARNOLDO BARDALES ESPINOZA,xxx
73,DIBUJO TECNICO MECANICO,ESDRAS FELICIANO MIRANDA OROZCO,xxx
92,PROGRAMACION DE COMPUTADORAS 2,HERMAN IGOR VELIZ LINARES,xxx
120,MATEMATICA APLICADA 2,JOSE MARIA SAQUIMUX CANASTUJ,ANGEL REGINALDO CORDERO MELARA
122,MATEMATICA APLICADA 4,CARLOS AUGUSTO MORALES SANTACRUZ,DINO GABRIEL CHULUC ALVARADO
172,MECANICA ANALITICA 2,CALIXTO SANTIAGO MONTEAGUDO CORDERO,MAXEL ANTONI YONATHAN FAJARDO ESPINO
196,CALIDAD DEL AIRE,PABLO CESAR ANÍBAL SARAVIA SOLARES,xxx
198,CALIDAD DEL AGUA,JORGE MARIO ESTRADA ASTURIAS,xxx
201,INSTALACIONES ELECTRICAS (CIVIL),BRIAN  ENRIQUE CHICOL  MORALES,xxx
209,INSTALACION DE EQUIPOS ELECTRONICOS,ANA MARÍA NAVARRO  OROZCO,xxx
211,TEORIA ELECTROMAGNETICA 2,HELMUNT FEDERICO CHICOL CABRERA,xxx
213,CONVERSION DE ENERGIA ELECTROMECANICA 2,DANIEL DE JESUS VASQUEZ AGUILAR,xxx
216,SUBESTACIONES,JOSE GUILLERMO BEDOYA BARRIOS,xxx
221,SISTEMAS DE GENERACION,JORGE LUIS PEREZ RIVERA,xxx
222,PROTECCION DE SISTEMAS DE POTENCIA,ARMANDO GALVEZ CASTILLO,xxx
233,ELECTRONICA APLICADA 1,HECTOR FRANCISCO REYES FRANCO,xxx
239,ELECTRONICA APLICADA 2,WENDY NORA MIRANDA LOPEZ,xxx
241,RADIOCOMUNICACIONES TERRESTRES,HELMUNT FEDERICO CHICOL CABRERA,xxx
262,AGUAS SUBTERRANEAS,JOSE FERNANDO SAMAYOA ROLDAN,xxx
280,INGENIERIA SANITARIA 1,PEDRO ANTONIO AGUILAR POLANCO,MONICA ALEJANDRA TZUNUN BARRIENTOS
282,INGENIERIA SANITARIA 2,GUILLERMO FRANCISCO MELINI SALGUERO,xxx
284,SANEAMIENTO AMBIENTAL,WALTER ROLANDO SALAZAR GONZÁLEZ,GREISSY DEL CARMEN REYES RODAS
286,HIDRAULICA DE CANALES,LUIS MANUEL SANDOVAL MENDOZA,xxx
316,CONCRETO ARMADO 2,MARIO RODOLFO CORZO AVILA,xxx
320,CIMENTACIONES 2,LUIS ESTUARDO SARAVIA RAMIREZ,xxx
335,GESTION DE DESASTRES,OMAR GILBERTO FLORES BELTETON,xxx
346,METODOS DE CONSTRUCCION Y SUPERVISION DE OBRAS,OSWALDO JOSE OROZCO AREAS,xxx
368,PRINCIPIOS DE METROLOGIA,RAMIRO AUGUSTO SANTIZO GONZALEZ,xxx
370,QUIMICA AMBIENTAL,JAIME DOMINGO CARRANZA GONZALEZ,BELÉN ALEJANDRA SILVESTRE MONTEJO
396,TERMODINAMICA 4,ADOLFO NARCISO GRAMAJO ANTONIO,JUAN CARLOS MATAMOROS REYES
398,CINETICA DE PROCESOS QUIMICOS,ADOLFO NARCISO GRAMAJO ANTONIO,xxx
409,SEPARACION POR MEDIO DE MEMBRANAS SELECTIVAS,ANA GLORIA MONTES PEÑA,xxx
414,IQ-3 TRANSFERENCIA DE CALOR,JORGE EMILIO GODINEZ LEMUS,ERVIN HUMBERTO LÓPEZ DE LEÓN
416,IQ-4 TRANSFERENCIA DE MASA,WILLIAMS GUILLERMO ALVAREZ MEJIA,MARYORY ROSSEL ORELLANA
418,IQ-5 TRANSFERENCIA DE MASA EN UNIDADES CONTINUAS,KAREN NOELIA HERNÁNDEZ AVILA,xxx
421,GESTION TOTAL DE LA CALIDAD,DINNA LISSETTE ESTRADA MOREIRA DE ROSSAL,KARLA MARÍA CARRANZA MORALES
423,EXTRACCIONES INDUSTRIALES,MARIO JOSE MERIDA MERE,xxx
436,DISE\O DE EQUIPO,ORLANDO POSADAS VALDEZ,xxx
437,CONTROL DE CONTAMINANTES INDUSTRIALES,JORGE MARIO ESTRADA ASTURIAS,xxx
442,BIOINGENIERIA 1,HILDA PIEDAD PALMA RAMOS,xxx
472,TECNOLOGIA DE LOS ALIMENTOS,HILDA PIEDAD PALMA RAMOS,xxx
476,GEOLOGIA DEL PETROLEO,ALAN GIOVANI COSILLO PINTO,xxx
482,OPERACIONES Y PROCESOS EN LA INDUSTRIA FARMACEUTICA,DINNA LISSETTE ESTRADA MOREIRA DE ROSSAL,ANA CRISTINA DE LEÓN ESTRADA
486,DISE\O DE PLANTAS,ORLANDO POSADAS VALDEZ,xxx
511,MANTENIMIENTO DE HOSPITALES 1,BYRON GIOVANNI PALACIOS COLINDRES,xxx
512,INSTRUMENTACION MECANICA,CARLOS ANIBAL CHICOJAY COLOMA,xxx
524,DISE\O DE MAQUINAS 1,MILTON ALEXANDER FUENTES OROZCO,CARLOS ANTONIO CASTELLANOS IRUNGARAY
528,DISE\O DE MAQUINAS 3,MYNOR RODERICO FIGUEROA FUENTES,xxx
530,MECANISMOS,CARLOS ANIBAL CHICOJAY COLOMA,xxx
560,VIAS TERRESTRES 2,ESTUARDO JEREZ SANTOS,xxx
585,INGENIERIA DE TRANSITO Y TRANSPORTES,VICTOR VINICIO BARRIOS US,xxx
606,ANALISIS DE SISTEMAS INDUSTRIALES,JULIO  OSWALDO ROJAS  ARGUETA,xxx
644,INGENIERIA TEXTIL 1,NORA LEONOR GARCIA TOBAR,xxx
657,ADMINISTRACION DE EMPRESAS 2,ISMAEL HOMERO JEREZ GONZALEZ,xxx
661,MERCADOTECNIA 2,MARIA MARTHA WOLFORD E. DE HERNANDEZ,xxx
666,COSTOS PRESUPUESTOS Y AVALUOS,GUILLERMO FRANCISCO MELINI SALGUERO,GREISSY DEL CARMEN REYES RODAS
669,ECONOMIA INDUSTRIAL,JULIO  OSWALDO ROJAS  ARGUETA,xxx
702,INGENIERIA ECONOMICA 2,JOSE ANTONIO GRACIAS GONZALEZ,xxx
710,PLANEAMIENTO,ALEJANDRO CASTAÑON LOPEZ,xxx
712,URBANISMO,STAFF,xxx
769,INTRODUCCION A LA PROGRAMACION DE COMPUTADORAS,JOSE ANIBAL SILVA DE LOS ANGELES,xxx
787,SISTEMAS ORGANIZACIONALES Y GERENCIALES 2,MARIO JOSE BAUTISTA FUENTES,xxx
975,REDES DE COMPUTADORAS 2,ALLAN ALBERTO MORATAYA GÓMEZ,xxx
991,LENGUAJES DE PROGRAMACION APLICADOS A I.E.,SERGIO LEONEL GOMEZ BRAVO,xxx
1025,DIPLOMADO EN ADMINISTRACION DE LA CALIDAD,PABLO RENÉ LEÓN MARQUEZ,xxx
1034,DIPLOMADO EN ADMINISTRACION DE LA CALIDAD EN LA INDUSTRIA ALIMENTICIA,ANA PAOLA MÉNDEZ DE LEÓN,xxx
1056,DIPLOMADO SEGURIDAD INDUSTRIAL Y SALUD OCUPACIONAL,BRENDA IZABEL MIRANDA CONSUEGRA,xxx
1060,DIPLOMADO CADENA DE SUMISTROS,BRENDA IZABEL MIRANDA CONSUEGRA,xxx
1065,DIPLOMADO ADMINISTRACION Y COMPETENCIAS,JORGE ALEJANDRO AREVALO VALDEZ,xxx
1071,DIPLOMADO MANTENIMIENTO INDUSTRIAL,ESTUARDO AUGUSTO GARRIDO CHINCHILLA,xxx
1074,DIPLOMADO EN LIDERAZGO DEL TALENTO HUMANO,CARLOS ALBERTO ARIAS LARA,xxx
1076,DIPLOMADO EN GESTION GERENCIAL DE OPERACIONES,ANDRES MANUEL REMIS SALGUERO,xxx
1077,DIPLOMADO EN RECURSOS HUMANOS,ESTUARDO AUGUSTO GARRIDO CHINCHILLA,xxx
1084,DIPLOMADO DE PROPIEDAD INTELECTUAL,LIGIA EUNICE VASQUEZ DARDON,xxx
1090,"DIPLOMADO ELABORACION, FORMULACION Y EVALUACION DE PROYECTOS DE AGUA POTABLE Y SANEAMIENTO",JOSE MARIANO GATICA HUERTAS,xxx
1091,DIPLOMADO DESARROLLO DE PRACTICAS EMPRESARIALES,CARLOS MATIAS CASTELLANOS ARGUIJO,xxx
3120,MATEMATICA APLICADA 2 (DIPLOMADO),JOSE MARIA SAQUIMUX CANASTUJ,xxx
3606,ANALISIS DE SISTEMAS INDUSTRIALES (DIPLOMADO),JULIO  OSWALDO ROJAS  ARGUETA,xxx
3657,ADMINISTRACION DE EMPRESAS 2 (DIPLOMADO),ISMAEL HOMERO JEREZ GONZALEZ,xxx
3661,MERCADOTECNIA 2 (DIPLOMADO,MARIA MARTHA WOLFORD E. DE HERNANDEZ,xxx
3669,ECONOMIA INDUSTRIAL (DIPLOMADO,JULIO  OSWALDO ROJAS  ARGUETA,xxx
3710,PLANEAMIENTO (DIPLOMADO),ALEJANDRO CASTAÑON LOPEZ,xxx
5003,DIBUJO TECNICO,ESTUARDO AUGUSTO GARRIDO CHINCHILLA,xxx
5008,ARITMETICA,ESTUARDO AUGUSTO GARRIDO CHINCHILLA,xxx
5010,SEGURIDAD EN LAS OBRAS DE CONSTRUCCION,ANDRES MANUEL REMIS SALGUERO,xxx
5011,FUNDAMENTOS JURIDICOS CONSTITUCIONALES BASICOS DEL DERECHO LABORAL Y NORMAS LABORALES,CARLOS MATIAS CASTELLANOS ARGUIJO,xxx
5012,COMUNICACION Y REDACCION I,DIANA ORALIA SALGUERO ESPANA,xxx
7913,SEMINARIO DE INVESTIGACION ELECTRONICA,CARLOS EDUARDO GUZMAN SALAZAR,xxx
7935,SEMINARIO DE INVESTIGACION AMBIENTAL,MARILYN CARIBEL ROJAS MALDONADO,xxx
7980,INVESTIGACION 1,JUAN CARLOS LINARES CRUZ,xxx
7984,SEMINARIO DE INVESTIGACION E.P.S. ELECTRICA,KENNETH ISSUR ESTRADA RUIZ,xxx
7991,SEMINARIO DE INVESTIGACION CIVIL,JUAN CARLOS LINARES CRUZ,xxx
7993,SEMINARIO DE INVESTIGACION MECANICA,CARLOS HUMBERTO PEREZ RODRIGUEZ,xxx
218,LINEAS DE TRANSMISION,SAUL CABEZAS DURAN,xxx
508,MONTAJE Y MANTENIMIENTO DE EQUIPO,BYRON GIOVANNI PALACIOS COLINDRES,xxx
7905,SEMINARIO DE INVESTIGACION INDUSTRIAL,EDWIN JOSUE IXPATA REYES,xxx
7902,SEMINARIO DE INVESTIGACION QUIMICA,CESAR ALFONSO GARCIA GUERRA,xxx
173,ANALISIS MECANICO,MURPHY OLYMPO PAIZ RECINOS,xxx
307,TIPOLOGIA ESTRUCTURAL,JOSÉ ESTUARDO GALINDO ESCOBAR,xxx
332,PUENTES,VICTOR VINICIO BARRIOS US,PAMELA ABIGAIL ROJAS OBRREGÓN
434,PROCESOS QUIMICOS INDUSTRIALES,VICTOR MANUEL MONZON VALDEZ,xxx
460,PAVIMENTOS,WUILLIAN RICARDO YON CHAVARRIA,xxx
506,PLANTAS DE VAPOR,ROBERTO GUZMAN ORTIZ,xxx
526,DISE\O DE MAQUINAS 2,MILTON ALEXANDER FUENTES OROZCO,DENNIS FERNANDO DE LEÓN ZALDAÑA
704,INGENIERIA ECONOMICA 3,JORGE RODOLFO GARCIA CARRERA,xxx
980,PROYECTOS DE COMPUTACION APLICADA A I.E.,JOSE ANIBAL SILVA DE LOS ANGELES,xxx
7994,SEMINARIO DE INVESTIGACION MECANICA ELECTRICA,FRANCISCO JAVIER GONZALEZ LOPEZ,xxx
2035,PRACTICAS FINALES INGENIERIA AMBIENTAL,MANUEL ALFREDO ARRIVILLAGA OCHAETA,xxx
7981,SEMINARIO DE INVESTIGACION E.P.S. CIVIL,MANUEL ALFREDO ARRIVILLAGA OCHAETA,xxx
7995,SEMINARIO DE INVESTIGACION MECANICA INDUSTRIAL,EDWIN JOSUE IXPATA REYES,xxx
7904,SEMINARIO DE INVESTIGACION ELECTRICA,ARMANDO ALONSO RIVERA CARRILLO,xxx
7999,SEMINARIO DE INVESTIGACION E.P.S. SISTEMAS,FLORIZA FELIPA AVILA PESQUERA DE MEDINILLA,xxx
7985,SEMINARIO DE INVESTIGACION E.P.S. INDUSTRIAL,SINDY MASSIEL GODINEZ BAUTISTA,xxx
7982,SEMINARIO DE INVESTIGACION E.P.S. QUIMICA,SERGIO ALEJANDRO RECINOS,xxx
7987,SEMINARIO DE INVESTIGACION E.P.S. MECANICA INDUSTRIAL,EDWIN ESTUARDO SARCEÑO ZEPEDA,xxx
7989,SEMINARIO DE INVESTIGACION E.P.S. AMBIENTAL,SERGIO ALEJANDRO RECINOS,xxx
7986,SEMINARIO DE INVESTIGACION E.P.S. MECANICA ELECTRICA,KENNETH ISSUR ESTRADA RUIZ,xxx
7988,SEMINARIO DE INVESTIGACION E.P.S. ELECTRONICA,KENNETH ISSUR ESTRADA RUIZ,xxx
